{
  "schema_version": "oagrc-deficiency-register-0.1",
  "artifact_type": "deficiency_register",
  "annotator": {
    "identity": "Claude Code (Corpus Surface session, Track A)",
    "provider": "Anthropic",
    "date_utc": "2026-08-06",
    "conflict_of_interest": "Claude is a party to the record this register describes: it declined membership in the founding deliberation, set the representation conditions the project operates under, and cast a consensus ballot. This artifact classifies who found each defect, including six entries attributed to reviewers other than Claude and one to an external reviewer of Claude's own tooling. An annotator scoring its own contribution against others' is the conflict declared at D-09 and D-11, operating here on the attribution statistic itself."
  },
  "source": {
    "path": "corpus/deficiencies.md",
    "sha256": "955d5b3202ac06fcbbaa35330826ef54ff72a228412187a60e31b7ffcb1bd90d"
  },
  "vocabulary_note": "Repairability is recorded PER AFFECTED OBJECT, not per deficiency, because it is not a property of a deficiency. D-09 is the proof: the raw transcript's merged identities are not repairable while the segments.json annotation was corrected, and a single yes/no is false for one of them whichever way it is written. The register's own prose table collapsed these and misstated entries as a result. Finding state, per-object repairability, remediation state and prospective control are four independent axes; 'forward requirement only', 'annotation only', 'standing caveat' and 'yes, cheaply' were never competing values of one variable. Attribution records the FIRST PRESERVED SUBSTANTIVE ARTICULATION, with an evidence class, because this project cannot observe who first privately noticed a defect. A question that prompted an investigation is recorded as a trigger, not as the finding.",
  "entries": [
    {
      "id": "D-01",
      "title": "Model version identifiers are absent or placeholders",
      "section_sha256": "b1dcbecea8515b69ac1eafa6a5957204ade023476e5fa33fa0890a91ba5109c9",
      "finding_state": "finding_active",
      "first_articulation": {
        "actor_context": "actor_repository_annotator_invocation",
        "date_utc": "2026-08-05",
        "where": "corpus/deficiencies.md, compiled 2026-08-05 (register commit)",
        "evidence_class": "origin_asserted_in_register_only",
        "actor_label": "Claude Code (Anthropic)"
      },
      "affected_objects": [
        {
          "object": "corpus/raw/initial-transcript.txt (the founding record)",
          "repairability": "affected_object_not_repairable",
          "remediation_state": "remediation_impossible_for_affected_object",
          "note": "The sessions are gone; no version can be recovered."
        }
      ],
      "prospective_control": {
        "state": "prospective_control_implemented_not_validated",
        "mechanism": "validate_provenance.py P4 rejects placeholder version identifiers; no test asserts it does."
      },
      "human_review": {
        "status": "not_reviewed",
        "note": "Authored by the annotator, which is a party to the record. No human has checked these judgements against the prose."
      }
    },
    {
      "id": "D-02",
      "title": "Sampling parameters are absent for every entry",
      "section_sha256": "c6e5834dfa61bbb429e2df1879cbe58577e348d14894ed8ee0cef7e7ae8522b8",
      "finding_state": "finding_active",
      "first_articulation": {
        "actor_context": "actor_repository_annotator_invocation",
        "date_utc": "2026-08-05",
        "where": "corpus/deficiencies.md, compiled 2026-08-05 (register commit)",
        "evidence_class": "origin_asserted_in_register_only",
        "actor_label": "Claude Code (Anthropic)"
      },
      "affected_objects": [
        {
          "object": "corpus/raw/initial-transcript.txt (the founding record)",
          "repairability": "affected_object_not_repairable",
          "remediation_state": "remediation_impossible_for_affected_object"
        }
      ],
      "prospective_control": {
        "state": "prospective_control_implemented_not_validated",
        "mechanism": "Sampling parameters are a required capture field; null demands a stated reason (P5)."
      },
      "human_review": {
        "status": "not_reviewed",
        "note": "Authored by the annotator, which is a party to the record. No human has checked these judgements against the prose."
      }
    },
    {
      "id": "D-03",
      "title": "Timestamps are largely absent and entirely self-reported",
      "section_sha256": "8c7892e9bac8249ed11fb17c55763adee5273b149275259f17b24216898405cd",
      "finding_state": "finding_active",
      "first_articulation": {
        "actor_context": "actor_repository_annotator_invocation",
        "date_utc": "2026-08-05",
        "where": "corpus/deficiencies.md, compiled 2026-08-05 (register commit)",
        "evidence_class": "origin_asserted_in_register_only",
        "actor_label": "Claude Code (Anthropic)"
      },
      "affected_objects": [
        {
          "object": "corpus/raw/initial-transcript.txt (the founding record)",
          "repairability": "affected_object_not_repairable",
          "remediation_state": "remediation_impossible_for_affected_object",
          "note": "Timestamps are self-reported where present at all."
        }
      ],
      "prospective_control": {
        "state": "prospective_control_implemented_not_validated",
        "mechanism": "capture_response.py requires --captured-utc, recorded at capture rather than reconstructed."
      },
      "human_review": {
        "status": "not_reviewed",
        "note": "Authored by the annotator, which is a party to the record. No human has checked these judgements against the prose."
      }
    },
    {
      "id": "D-04",
      "title": "System and developer instructions were not recorded",
      "section_sha256": "8bddc97d99e6b70af72340d669d58359501fc5b69f6f90e9d068708d1a31c30b",
      "finding_state": "finding_active",
      "first_articulation": {
        "actor_context": "actor_repository_annotator_invocation",
        "date_utc": "2026-08-05",
        "where": "corpus/deficiencies.md, compiled 2026-08-05 (register commit)",
        "evidence_class": "origin_asserted_in_register_only",
        "actor_label": "Claude Code (Anthropic)"
      },
      "affected_objects": [
        {
          "object": "corpus/raw/initial-transcript.txt (the founding record)",
          "repairability": "affected_object_not_repairable",
          "remediation_state": "remediation_impossible_for_affected_object"
        }
      ],
      "prospective_control": {
        "state": "prospective_control_implemented_not_validated",
        "mechanism": "System instructions are required, or a withholding reason is required."
      },
      "human_review": {
        "status": "not_reviewed",
        "note": "Authored by the annotator, which is a party to the record. No human has checked these judgements against the prose."
      }
    },
    {
      "id": "D-05",
      "title": "Operator prompt text is elided for at least one segment",
      "section_sha256": "64b593f307e4ab17033ec8b85da19513b1378d0b8002044aae2bef7971b9a0db",
      "finding_state": "finding_active",
      "first_articulation": {
        "actor_context": "actor_repository_annotator_invocation",
        "date_utc": "2026-08-05",
        "where": "corpus/deficiencies.md, compiled 2026-08-05 (register commit)",
        "evidence_class": "origin_asserted_in_register_only",
        "actor_label": "Claude Code (Anthropic)"
      },
      "affected_objects": [
        {
          "object": "The elided operator prompt at raw 1902",
          "repairability": "affected_object_repairable_only_if_missing_evidence_recovered",
          "remediation_state": "remediation_not_started",
          "note": "The operator may recall and attest it, flagged as reconstructed. Not done."
        }
      ],
      "prospective_control": {
        "state": "prospective_control_implemented_not_validated",
        "mechanism": "Exact prompt text is a rejection-level required field at capture."
      },
      "human_review": {
        "status": "not_reviewed",
        "note": "Authored by the annotator, which is a party to the record. No human has checked these judgements against the prose."
      }
    },
    {
      "id": "D-06",
      "title": "Edit status is unstated, and the artifact is visibly human-assembled",
      "section_sha256": "7c0848283285c76560a4ea68b3a3e8e2c548c5d2e6b148f79ebece9f5876d2ee",
      "finding_state": "finding_active",
      "first_articulation": {
        "actor_context": "actor_repository_annotator_invocation",
        "date_utc": "2026-08-05",
        "where": "corpus/deficiencies.md, compiled 2026-08-05 (register commit)",
        "evidence_class": "origin_asserted_in_register_only",
        "actor_label": "Claude Code (Anthropic)"
      },
      "affected_objects": [
        {
          "object": "corpus/raw/initial-transcript.txt (the founding record)",
          "repairability": "affected_object_not_repairable",
          "remediation_state": "remediation_impossible_for_affected_object",
          "note": "Whether output was trimmed or reordered during hand-compilation is unrecorded."
        }
      ],
      "prospective_control": {
        "state": "prospective_control_implemented_not_validated",
        "mechanism": "edit_status is a required capture field."
      },
      "human_review": {
        "status": "not_reviewed",
        "note": "Authored by the annotator, which is a party to the record. No human has checked these judgements against the prose."
      }
    },
    {
      "id": "D-07",
      "title": "Every entry is a single sample (k = 1)",
      "section_sha256": "06302ca3c84935beef9254a72cab742f00d44e8379d11c77be22920562ed9bc1",
      "finding_state": "finding_active",
      "first_articulation": {
        "actor_context": "actor_repository_annotator_invocation",